	id	created_at	full_text
1147	681111708274790400	2015-12-27 13:57:40	free travel on downtown line (including downtown line 1) from 27 december 2015 to 1 january 2016. light crowds at all dtl stations.
1148	681053877001519104	2015-12-27 10:07:52	light crowds at all dtl stations except for moderate crowd at bukit panjang and beauty world stations.
1149	681040035680919553	2015-12-27 09:12:52	remember, you have to start and end your journey at any of the 18 dtl stations to enjoy free travel!
1150	681022840049504256	2015-12-27 08:04:32	1600hrs: light crowds at all dtl stations except for moderate crowd at bukit panjang and beauty world stations.
1151	681001383898697728	2015-12-27 06:39:16	rt @ltasg: remember, you have to start and end your journey at any of the 18 dtl stations to enjoy free travel! https://t.co/hxx33cxnjf
1152	680990792870006785	2015-12-27 05:57:11	1355hrs: light crowds at all dtl stations except for moderate crowd at bukit panjang and beauty world stations.
1153	680988088164728832	2015-12-27 05:46:27	light crowds at all dtl stations except for moderate crowd at bukit panjang station.
1154	680961831012179968	2015-12-27 04:02:06	free travel on downtown line (including downtown line 1) from 27 dec 2015 to 1 jan 2016. light crowds at all dtl stations at 12 pm.
1155	680931105806008320	2015-12-27 02:00:01	free travel on downtown line (including downtown line 1) from 27 dec 2015 to 1 jan 2016. light crowds at all dtl stations.
1156	680902978623029248	2015-12-27 00:08:15	free travel on downtown line (including downtown line 1) from 27 december 2015 to 1 january 2016. light crowds at all dtl stations.
1157	679905467603144704	2015-12-24 06:04:30	dtl 2 will open for passenger service on sun, 27 dec 2015. with the dtl2, commuters can zip from bukit panjang to chinatown in 37 minutes.
1159	679825973840224257	2015-12-24 00:48:37	service 156 will serve an additional bus stop along dunearn road, opposite dt7 sixth avenue station from sunday, 27 december 2015.
1166	679473736894922757	2015-12-23 01:28:57	train services on the nel, dtl, as well as the sengkang and punggol lrt, will extend by about one-and-a-quarter hours on christmas eve.
1187	672943682077659137	2015-12-05 01:00:51	rt @ltasg: start your #saturday on a happy note by joining us @ #dtl2openhouse (10am-6pm) at all 12 new stations! fun games &amp; activities aw…
1191	672248995717111808	2015-12-03 03:00:25	dtl, nel &amp; punggol/sengkang lrt services will start earlier on 6 december 2015 for standard chartered marathon.
1212	662479631040122880	2015-11-06 04:00:26	operating hours of dtl, nel, punggol/sengkang lrt &amp; 26 selected bus services will be extended on the eve of deepavali, mon, 9 nov 2015.
1235	657341632862273536	2015-10-22 23:43:52	train service has resumed on downtown line stations. free boarding of buses still available. we are sorry for inconvenience caused.
1236	657340270837501953	2015-10-22 23:38:28	no dtl svc btwn bgs dt14 &amp; cnt dt19. to continue your journey free bus rides available at designated bus stops.
1252	647318544359682049	2015-09-25 07:55:42	27 sep, 5pm - 11pm: svcs 2, 12, 33, 54, 63, 124, 143, 147, ct8 &amp; ct18 to skip bus stops in chinatown due to chinatown lantern walk 2015.
1257	644762049168277505	2015-09-18 06:37:06	operating hours of dtl, nel &amp;punggol/sengkang lrt services, will be extended by abt 1.5 hrs on 18 sep &amp; by at least an hr on 19 &amp; 20 sep.
1258	643969136062676992	2015-09-16 02:06:21	operating hours of dtl, nel, punggol/sengkang lrt &amp; 26 selected bus services will be extended on the eve of hari raya haji, wed, 23 sep 2015
1259	642568847950635008	2015-09-12 05:22:06	svcs 2, 12, 33, 54, 63, 80, 124, 143, 145, 147, 166, 197, ct8 &amp; ct18 to skip bus stops in chinatown on 13 sep, from 2pm to 11pm.
1273	640709849655832576	2015-09-07 02:15:06	operating hours of dtl, nel, punggol/sengkang lrt and 26 selected bus services will be extended on the eve of polling day, thu, 10 sep 2015
1286	629243062066122752	2015-08-06 10:50:11	dtl, nel and the punggol/sengkang lrts will have their services extended on 6, 8 and 9 august 2015.
1298	618636116959236097	2015-07-08 04:21:58	dtl, nel, punggol/sengkang lrt and 26 selected bus services will be extended on the eve of hari raya puasa, thursday, 16 july 2015
1315	604190171735580672	2015-05-29 07:38:56	#dtl, #nel, #punggol/sengkang lrt will be extended by half-an-hour on 5 &amp; 16 june (opening and closing ceremonies of the sea games).
1316	602686631405981697	2015-05-25 04:04:24	operating hours of dtl, nel, punggol/sengkang lrt and 26 selected bus services will be extended on the eve of vesak day, sunday, 31 may 2015
1320	591067237504581632	2015-04-23 02:33:05	dtl, nel, punggol/sengkang lrt and 26 selected bus services will be extended on the eve of labour day, thursday, 30 april 2015
1325	582763264922161152	2015-03-31 04:36:04	dtl, nel, punggol/sengkang lrt and 26 selected bus services will be extended on eve of good friday, thursday, 2 april 2015.
1332	581771302869938176	2015-03-28 10:54:22	28 mar: last lrt train departing from sengkang town centre will be at 1.52am and from punggol town centre at 1.54am.
1333	581770807078088705	2015-03-28 10:52:23	28 mar: last train departing from chinatown dt19 will be at 12.48am and from bugis dt14 at 12.49am.
